text,source
1-Lets merk that punk!2-Aha he got merked man....3-Lets merk billy in the pond!,urbandictionary
Miserlou      Arthur Lyman.... Taboo    (1958)   https://youtu.be/9Lx2vJFNBzc,gab
Killing me to see gays treated like that. I think lesbians are being more privileged by people,ethos
Dharun Ravi Sentencing: How Should The Former Rutgers Student Be Punished? (VOTE),kaggle_news_crime
Teaching my kids transgenders are anything but mentally ill will get you set on fire.,ethos
"Given the opportunity, I would be tempted to corner, subdue and ass-rape Brian Kilmeade.",gab
"its a good thing im not a commander or so in the police force,specially not during something like this,because the jail would be full of ppl waiting to be deported,if not dead",ethos
"Yes ma'am, and we'll warm up @TheRealDonaldTrump45 before we shove him in an oven. ",gab
"nah, you and your nazi friends are going to be sent back to your inbred shack towns or end up in body bags.",markov2022
Suspect In Cop Killings Found Dead Inside Mississippi Jail Cell,kaggle_news_crime
"Oh Christ, no more autism please, hearing about it as nauseam is starting to make me sick. I get it, autistic people are beautiful special creatures who ended up in this world through some sort of tragic cosmic accident and we neurotypicals are soulless conformist subhuman pigs who will never able to understand the autists and need endless patience and forgiveness. Can we now get on with our lives please?",ethos
THEN WHY HAVEN'T THEY BEEN HUNG FOR TREASON!,gab
NYPD Sergeant Shot In The Face While On Duty In Queens,kaggle_news_crime
One night he listened to a friendly old man slowly die alone in the next cell after a bout of torture.,dictionarydotcom
I don't mind the occasional gas the kikes thrown in as long as it's satirical and makes me laugh a bit at their discomfort. 😎,gab
To be honest this raises a good point about how little americans care for social justice outside of African-Americans. Native Americans are the most disadvantaged people in this country in so many ways but get only a fraction of the attention that African-Americans get. I'm not saying African-Americans should get less attention but we really need to take a step back and talk about Native American in a new context and on a new timeline.,kennedy2020
"Plant outbreaks gummed up the meat supply chain, creating a backlog of animals awaiting slaughter.",dictionarydotcom
Severed Foot Discovered In Berkeley BART Station,kaggle_news_crime
"Netherlands Prosecutes Its Own Citizen For Calling Turkish Dictator A ""Goat F*cker"" ",gab
"Shackles were put on my ankles, with open ends down, and an iron bar was pushed through the eyelets of the shackles. “The iron bar was tied to the pallet and the shackles in such a way that when the rope was drawn over a pulley arrangement, the bar would cut into the backs of my legs, gradually turning them into a swollen, bloody mess. The pulley was used daily to increase the pressure, and the iron bar began to eat through the Achilles tendons on the backs of my ankles. For five more days and nights I remained in the rig.”""

That is brutal and that is what he survived. are you sure? yes",markov2022
"To hear “Jews will not replace us” and “blood and soil” chanted these several years later after the <Organization> defeated the Nazis in World War II, brings a different sort of recollection to mind, such as images of Auschwitz and “sieg heil” chants before and after Crystal night ( Kristallnacht).",markov2022
Every slant in #LosAngeles should be deported. Those scum have no right to be here. Chinatown should be bulldozed.,kennedy2020
San Bernardino Shooting Report Details Heroism And Horror,kaggle_news_crime
"He has that look about him, that look that says he will hold one in his jaw till the swelling goes down.",gab
"""Sarah's eye is all bruised, what happened to her?"" ""Oh, her BF gave her the Chris Brown."" ",urbandictionary
"The backstory:

I rolled in my mom's car in the desert on May 23rd, 2014. Me, my friend and mother were all involved.

Luckily, I got the worst of the aesthetic injuries, but my mother broke her neck and had a stroke and such. She made a full recovery and is walking/talking to this day. My friend walked away with cuts and bruises. Everything in the car (electronics, clothes, laptops) survived, except the car itself. I'm extremely lucky that I walked away with an almost missing arm only. Don't know what caused the split though, whether it was just pressure from the car on top of it, or if it was a shard of glass tearing through.

I was life flighted to Vegas where I got stitched up. My muscle had torn all the way through (that's all tendon and ligaments), and that had to be sutured, my skin was stapled back together. I got a skin graft about 2 months later and now it's almost fully healed.

More images of the following months [here in this album](<URL>

Rolling in a car is definitely an unreal experience. I constantly dream of the night that it happened, the rolling playing over in my head again and again. Luckily, a doctor and nurse were some of the first to stop and help. Definitely thankful for everyone who helped me.

Oh, and by the way, life flights cost about $44,000 in case you were all wondering. That and all my other bills amounted to ~$150,000 that night. Phew!",markov2022
fucking monkeys kill them all,ethos
I always thought one of these would look good on the White House lawn.,gab
HOPE THEY KNOCK HER ASS TO THE GROUND AND RIP HER DRESS OFF AND SHAME HER....NOW THATS A POWERFUL IMAGE.,ethos
Every gook in #LosAngeles should be deported or killed.,kennedy2020
"Oh absolutely, one becomes less inhibited and for me all my rage and sadness comes spilling out at the end of a night of heavy drinking and the alcohol numbs the physical pain and also causes you to bleed more because alcohol thins your blood.",markov2022
trump is the only jews true friend. I hope trump will be the next US president and help Israel to kill all Palestinian fucking muslim. we will kill all muslim in the world.,kennedy2020
"And because Bud had a sore spot in his own heart, Bud felt a quick stab of understanding and sympathy.",dictionarydotcom
Hey Sweden do you remember back in time when your men were vikings and acted around like they had a dick between their leg... BLOCKED,ethos
"It went hard with him to slaughter the faithful creature, who knew him, and came towards him at the first sound of his voice.",dictionarydotcom
The Isla Vista Shooting: One Flew Under the Cuckoo's Nest,kaggle_news_crime
"Iowa Issues Gun Permits To The Blind, Allowing Them To Carry In Public",kaggle_news_crime
Ahmad Khan Rahami's Dad: I Reported My Son To The FBI Years Ago,kaggle_news_crime
"The problem is that the left has continually repudiated Christian values & replaced them with a dualist approach to life, where any crime by someone who is a leftist can be excused or ignored... ",gab
How can anyone be converted forcebly? What profits Christianity. May be Hindu groups are jealous of Christians up coming. They want Christians to be Hindu goons. Who is that tied saffron on forehead. Is he gaurdian of Hinduism like Shankar Acharya or Vivekananda?,ethos
"At 7:19 is why I hate people, women especially look how mad she got just because the dog splashed her.. f*** you you stupid b**** either have fun or go kill yourself",kennedy2020
"Transgenderism is a DISEASE. Transgenders are an abomination. Not only that, but they're also lying to themselves. You CANNOT. change your DNA from male to female, or from female to male.  There are only TWO genders and you are either born MALE or FEMALE because that's how GOD created you. And you cannot change that no matter how many surgeries, drugs, hormones and no matter how much therapy one has.  FACT",ethos
fenno decapitated holla whilst grace was teaching fenno the Heimlich's maneuver if you know what i mean,urbandictionary
#whitepower...I'll hang you nigger,kennedy2020
"""getting merked on a tram over roosevelt island"" (from El-P's Deep Space 9mm on Fantastic Damage",urbandictionary
"I am confident that my cock will be more than enough to impregnate <Person> and all of her friends in front of everyone. With their help, I will finally have my revenge!",markov2022
"Yes, in barbaric, authoritarian cultures that have since been condemned. Interesting that Christians desire to perpetuate the same idea.",kennedy2020
15th-Century Cannonballs Likely Used by Vlad the Impaler Discovered in Bulgaria,reddit
A large coalition of Palestinian civil society groups is now calling on Oxfam to sever ties with her “immediately.”,dictionarydotcom
Stupid feminists. For FUCK sake! Just....Just....fucking kill yourself.,ethos
"Michigan Man Sprayed Poison On Open Food At Grocery Stores, FBI Says",kaggle_news_crime
Driver Plows Into Pedestrians At Irvine Meadows Amphitheatre,kaggle_news_crime
"At 7:19 is why I hate people, women especially look how mad she got just because the dog splashed her.. f*** you you stupid b**** either have fun or go kill yourself",kennedy2020
NEVER underestimate the threat from the Dragon . . I still stand firm . . our biggest foreign threat China has been upgrading their entire country . . energy . . roads . . weapons . . manufacturing the China you see today . . NOT the same China a decade ago yes . . they have high population . . but they have improved their War Machine preparing for something BIG !,gab
I would beat the shit out of every Russian,ethos
Dog bite/infection,reddit
wE HAVE a Free market in America muh....  ,gab
That woman's a stupid fucking cunt. He should've beat her half to death and fully brain dead,kennedy2020
"Why can't just everyone mind their business , why can't palestine and israel live together , why are people dying from hunger while some can buy a whole country , it really makes me wanna kill everyone including myself .",markov2022
"Men can see beauty, so they don't want to sleep with black women or make goblin babies.",ethos
"how are you gonna downplay someone's experience with racism? ""People are racist everywhere I'm pretty sure"" are you kidding me? URL",kennedy2020
"I wish the war would start now instead of 50 years from now. If it started now, I could participate in it. We could have a new age of Homeric achievement. Instead I'll probably have to die not knowing how it's going to end.",gab
"I started self harming around 5th grade, so 11 or 12 years old.",markov2022
Texas Lawmaker Recovering After Hit By Stray Bullet While Celebrating New Year,kaggle_news_crime
Skin graft,reddit
"I don't know what to say, but you're not alone. I have fantasies of flaying my skin, gutting myself, impaling myself, gnawing off limbs, all sorts of really fucked up shit. I stare at accidental injuries too, wonder what it'd be like if I did them to myself. 

It's not always that bad but it *gets* that bad. I'm so sorry you deal with the same thing, it makes me feel like a total freak. I've been in therapy for years and while it's definitely improved the frequency at which they happen, my bad days are still that bad. 

I hope things get better for you.",markov2022
"<Person> is the 14-year old princess of the Fire Kingdom, and is one of <Person>'s friends. <Person> the Human/Flame Princess; <Person> the Human; Flame Princess (Adventure Time) Femdom; Edging; Mind Break; Orgasm Denial; small penis humiliation; Summary. This is a list of all the episodes that Flame Princess has appeared in. Her evil father, the Flame King, locked her in a lantern so she wouldn't take his reign. theorys, adventure, time. Season 4 was where she got her boost as a major character in the show and she became wildly popular and recurring in season 5. A Tabletop RPG created by <Person>. Like all other inhabitants of the Fire Kingdom, she is covered with fire, the very flames emitted from her body being extensions of herself that intensify with rage.",markov2022
My self harm started out with headbanging. I've stopped cutting/scratching/burning but I still hit things or myself for the pain and bite the insides of my cheeks till they bleed. It still counts as self harm. You belong here.,markov2022
"wassup chib, that shits off da heezy",urbandictionary
"""@iamkrause: No need to thank me, killing niggers is it's own reward.""  Dis my pal from our graduation when we was 26",kennedy2020
#whitepower...I'll hang you nigger,kennedy2020
Put a woman to abuse that fat woman and don’t put a kind guy,ethos
"Correct: Billy Costigan (DiCaprio) was murked in an elevator in ""The Departed."" Wrong: I murked that bowl of oatmeal for breakfast.",urbandictionary
"Taken from your 'Wikipedia source'

My point about males being violent and dominant.


'Rank among males is often violently enforced and the alpha status heavily coveted. Male bonobos are known to attack each other and inflict serious injuries such as missing digits, damaged eyes and torn'


And the female bonobos are the care givers like I said


'Entirety of parental care in bonobos is assumed by the mothers'

It seems twisting facts to suit you narrative isn't really working. Science doesn't care about your feeling. 

Male are naturally more dominant and females are naturally the caregivers",markov2022
"NO U. FITE ME BIOITCH = succ my balls because I am gay and want to have sexual relations with no condom while I spread my AIDs everywere I go, in russian.",kennedy2020
im going to castrate you you and shove them down your throat,urbandictionary
"This is why we won, because Americans know that giving these people power for another day is unacceptable. We need to fight back against the Synagogue and their White/Mexican/Black Communist useful idiots they get to do their dirty work for them. I am armed and I am ready for these scum if they try to resist being sent back to Mexico/Guatemala all these illegal invaders that want to invade our nations and change it to suit their savage ways. Illegals must die.",kennedy2020
"Lol, you're not white, you're a Jew. Jews are the worst nation and they must be annihilated, so like you",ethos
"when third world apes run the business, it either caters successfully to other third worlders or it implodes! South Africa (at one time) could feed the world…… now they need to import food, like cuba, venezuela, et. al. . OUR democrap party wants to rule over a banana republic – why should THEY be any different? 🙄",markov2022
"He also wrote, “Torture is not a thing that we can tolerate.”",dictionarydotcom
"Wyl i endors yor sentiments bout mothrz, i hav 2 wondr bout mothrz who raiz ther kidz 2 b #Dumokraps. That iz far from nurturin.",gab
A bored Vampire.,gab
"We signed the Mayflower compact so we could throw the corrupt ass***es out of our government. Keep up the good work Patriots in the WH. True Patriots are proud of everything you are doing to cut the cancer out of our Republic. Just remember Treason = 1 bullet, 1down - NEXT! Never have to deal with those traitors again. God Bless!",gab
What a dickens is the Woman always a whimpring about Murder for?,dictionarydotcom
"Murder, rape, arson, and a host of other atrocities are often the first evidence of a diseased brain.",dictionarydotcom
who gives aa fuck about shit diamonds from the jews fuck them both,ethos
" Feminists would have went mental, miles of column inches in the <Organization> would have been taken up castigating the people involved. But when it's women doing it and it's 'cultural' different rules are believed to apply.You can spot the fact that they think they are on very dodgy ground when names are refused, nor would I expect women to question it, after all they are pretty much used to not thinking equality rules apply to them, but to men alone. Throw in the 'Asian' buzzword for raving Muslim fanatics who are so afraid to show their faces in case (only Muslim) men will sexually assault",markov2022
Mom Charged In Disabled Child's Death Could Get $1 Million,kaggle_news_crime
"Fight me, communists.",gab
They are laughing and their countries are poor evil murderes and all corrupted good job.,ethos
Black Friday 2012 Walmart Shooting: 2 Shot Outside Tallahassee Retail Location,kaggle_news_crime
A handful of books you wrote,gab
"Oh GOD YES!!!! Feel the shrapnel pierce through your skin, let the fire consume your flesh and lay lifeless on the unforgiving sand that seeps into your wounds. Your screams is what gives Murcia the fuck yeah in the most patriotic songs on earth. BURN IN HELL YOU GOATS !!!",ethos
Falling Palm Tree Kills Man Going To Funeral,kaggle_news_crime
"Posted October 4, 2013 The <<Organization>> and the <<Organization>> are co-sponsoring a webinar titled,...

<Organization> Bans Three Arsenic Drugs for Poultry and Pig Feed

October 4, 2013

<Person>

Posted October 4, 2013 The <<Organization>> (<Organization>) has announced that it will rescind approval for three arsenic...",markov2022
Archaeologists Uncover a Wall Made of 119 Skulls at Mexico City's Huei Tzompantli,reddit
The coronavirus hit the fashion industry with a tough combination of punches.,dictionarydotcom
"Ungrateful parasite 'augustine',we are taking our Bharat back and we are going to reconvert you or throw you out.",kennedy2020
"STOP SUCKING THAT FATASS' DICK, YOU NIGGERLOVING KIKE",kennedy2020
What about to shove your crutch to your ass  ,ethos
Apparently the Democrats SOTU strategy was to look as evil as hell before the 45 million Americans who watched and 80% who liked the Donald's speech.  Brilliant.  <snicker>,gab
When Iron Dome misses -- and it does sometimes miss -- the Gaza rockets kill and maim only within a very limited radius.,dictionarydotcom
"Person 1: ""Fuck you man, I will kick the living shit out of you!""Person 2: ""Shit can be alive?""",urbandictionary
How else is he supposed to MAGA?,gab
"Follow you home and when you are carrying bags inside I'd follow you in, put my hand over your mouth so you can't scream and ram my cock inside you until I've decided I've had enough fun raping your tight pussy.",kennedy2020
"""@iamkrause: No need to thank me, killing niggers is it's own reward.""  Dis my pal from our graduation when we was 26",kennedy2020
Just got shoah'd AGAIN. 3 shoah's in 3 days. I hope those stupid faggots at twitter hang themselves  Their bots are fucking shit. Dumb dirty kike faggots All bc I started a curious cat acct,gab
"""I hurt myself today, to see if I still feel, I focus on the pain, the only thing that's real. The needle tears a hole, the old familiar sting, tried to kill it all away but I remember everything."" - Hurt, Nine Inch Nails",urbandictionary
"He'll flip ya, flip you for real!",urbandictionary
"My wife kept complaining about headaches, so she tried decapitation, and she hasn't complained since.",urbandictionary
"STOP SUCKING THAT FATASS' DICK, YOU NIGGERLOVING KIKE",kennedy2020
Eric Frein's Neighbors: 'We're Prisoners In Our Own Homes',kaggle_news_crime
They used to declare that every unbaptised baby would go to Hell and burn for ever in fire and brimstone.,dictionarydotcom
"In late May, Lewellen began to contemplate a decapitating strike against the southern Albemarle’s revolutionary elite.",dictionarydotcom
What logic is put into hurting something?,urbandictionary
Veterinary Board Seeks To Revoke License For Texas Vet Who Killed Cat With Arrow,kaggle_news_crime
The sad fact is that more than 41 percent of trans people admit making at least one suicide attempt in their lifetime.,dictionarydotcom
It’s National beat the living shit out a ginger day let’s go beat up the ginger twat,urbandictionary
Just a little work on the eyebrows and you could be a waitress by day and an annoying freeloader at some dudes house at night.,ethos
That Asian bloke needs a shave or cover up his hideous beard with a burqa!,ethos
Being blind would make me want suicide. Go kill yourself kid,ethos
Decapitated are better than you.,urbandictionary
Look at these gay ass niggas. lol. Acting like they some bitches.,ethos
"A very disturbing, completely real time compilation of 9/11 live coverage and amateur clips, remastered in 60 FPS where possible",reddit
"Patrick Lynch, had said that De Blasio should stay away from the funerals of any police officers killed in the line of duty.",dictionarydotcom
Kansas Chemical Leak Causes Respiratory Issues For More Than 100,kaggle_news_crime
Yea. 2 broken cheek bones. Broken eye socket and fractured the other eye socket. And broke his nose. All while wearing a helmet!,markov2022
"This started as a notch-shaped cutout, and companies have lately worked that down to a single circle that looks like someone took a hole punch tool to the display.",dictionarydotcom
DO YOU SEE HOW QUICK THE PROSECUTED THAT BLACK COP IN MPLS. MN. FOR KILLING THAT WHITE NIGGA??? GUESS BARR HAND A HAND IN THAT TO HUH. THESE NIGGA'S ARE GONNA GET THEIR DAY!!,kennedy2020
Granny Schicklgruber's Cherries Jewbilee Recipe ,gab
Judge: You are being executed by decapitation!Criminal: Damnit.,urbandictionary
"“You might as well punch yourself in the face,” he says when asked if he read about any of the controversy.",dictionarydotcom
The best we thing we can do is Sterilize these women and try to save the children.,ethos
"Yes , it matters to the filthy nazi-islamic about his skin-cause it counts. We can see that the inbreeding has affected their brains . I would like to see the slaves and those dominated by filthy islam turn on their captors and kill them all.. Islam is such a lie -I still imagine that all these damn criminals of islam do is think how many more lies they can make up to further dominate their populations and subdue them.Yes this may be the time that the infidels destroy islam. PRAY FOR THIS ACTION ~

Hard to invent anything with an IQ of 60.. Inbreeding works! The <Organization> have succeeded.",markov2022
"have you decided whether you're gonna try to let the skin flap reattach or tear that bad boy off? I once accidentally closed a freshly sharpened folding knife on my thumb and took a pretty similar chunk. I opted to tear mine off, bad idea in hindsight",markov2022
I'm gonna merk babyface so hard she'll never get merked again i just got merked by some white boy i forogt to wipe my butt and i just merked my white briefs,urbandictionary
Florida Police Release Eerie New Surveillance Video In Hunt For Suspected Serial Killer,kaggle_news_crime
"And when his speech becomes a kitchen knife sawing away at your son’s throat – if you don’t kill him you have become the same monster as he. Worse – he isn’t killing his own son. The West is watching as islam is killing our sons. And when they begin killing others for a belief or a thought or a speech, then only one solutions exits: kill them before they kill you.",markov2022
"In mid 2015, I received surgery to correct my scoliosis with rods and bolts. The whole operation took around 9 hours and these are the healing process photos.",reddit
Indigenous ‘forest guardians’ murdered in Brazil,reddit
"""@iamkrause: No need to thank me, killing niggers is it's own reward.""  Dis my pal from our graduation when we was 26",kennedy2020
"...Yeah? The same way cops are illogically apprehensive when they come in contact with suspects? Oh no, it's fine when women do it.",kennedy2020
"ALONG WITH ILLINOIS, NEW YORK, MASSACHUSETTS, NEW JERSEY, WASHINGTON, OREGON... AND MORE COMING! HOWEVER, THEY BETTER NOT POLLUTE THE RED STATES THEY MOVED TO, CUZ THERE WILL B E HELL TO PAY!!!!",gab
"""Hey _____ likes self-harm what a fucking emo haha!""""You sick fucking bastard don't speak to me again.""",urbandictionary
Daryl likes rap AKA The Music You Hate With A Passion,gab
Why don't they just use handicapped restrooms for the mentally challenged? Problem solved!,ethos
4wks post fasciotomy to relieve compartment syndrome in my foot. Still swells & turns this nice shade of purple when not elevated,reddit
Fck  serbije  kill  them all,ethos
Michael Bennett Gardner Demands Harsher Sentence As Recognition For Marijuana Grow Op,kaggle_news_crime
"He thought he was helping me with my Tea. He saw me do it every morning, and when I went upstairs to get dressed, he took the opportunity to be helpful..... worst day of my life, and his aswell...",markov2022
"BillyLeShawn! If you lose my tools, I will kick the the living shit out of you!",urbandictionary
If men shouldnt hit women because we are physically stronnger... then women shouldnt talk because they are fucking louder.,ethos
"in the spirit of AC Joint seperations, here is my grade 5 seperation from getting dropped crowd surfing",reddit
Haven't memed for a while. Feels good to be back! :D #BadBusiness #Enterprise #Exitprise #VirtueSignaling #Smug #NRA #2A,gab
Woman Found Living With Corpse: Police,kaggle_news_crime
"I do it as punishment. Started in my 30s. I am a horrible human being, a mean B, UN reliable, an addict, a lazy POS. I wish I had the balls to just kill myself already but I don't. So until I do, being in pain and scarred is my payment for the misery I bring to the world.",markov2022
That's right would have to be at least two more because someone is going to need to shut your whore mouth up while my cock rapes your asshole over and over again while daddy's other friend is in your slutty little cunt.,kennedy2020
To Those of You on Hunger Strike,kaggle_news_crime
we should attack china,markov2022
When you came into my country you knew you are going to be slave and work building shits. So shut up and take it cause otherwise am going to end you and get you out of here sand shit,ethos
The Streets of Mogadishu on October 3th 1993,reddit
