text,source
"Her name was <Person>, she was <Person>'s teacher. <Person> made him repeat <DateTime>.
and it wasnt even his fault. she just hated men. <Person> didnt only had to repeat <DateTime> but he had to pay the school again. it wasnt fair.

<DateTime> <Person> found out where she lived and wanted to get his revenge.


I had been following her for weeks, studying her every move. I knew she was the one who had made me repeat <DateTime>, and it cost me a lot of money to have to pay for it again. But I wasn't going to let that stop me from getting my revenge.

I waited until nightfall, when I knew she would be alone, and then rang her doorbell. She answered surprised, ""What are you doing here <Person>?"" I grinned at her maliciously and said ""I missed you"" as I pushed my way into her house and slammed the door shut behind me.

Looking around menacingly, I asked her ""Do you live here alone?"" <Person> tried to push past me but I grabbed onto her arm tightly and pulled her close roughly saying ""Don't worry sweetheart, I'm not here for that"". My hand traveled up underneath  skirt seductively before yanking them off entirely leaving   bare bottomed on display in only a white button up shirt. Full of rage yet still helpless against my strength she cried out ""Get out of my house! <DateTime>!"" Taking a step closer so our noses were almost touching  looked deep into eyes repeating calmly yet forcefully"" Do you know what you did to me? Because of you I had to repeat <DateTime> and pay for it all over again. It cost me a lot of money, but don't worry sweetheart"" as my hand clamped down harshly over her mouth ""I'm not here for that"".

Releasing her mouth  pulled her onto the couch none too gently before claiming   lips in a deep passionate kiss. Our tongues entwined hungrily as my hands grabbed fistfuls of hair roughly pulling her head back to deepen the kiss. My other hand worked its way under   shirt pushing it up and off so  was <DateTime> left completely naked save for   high heels. Taking a step back from <Person> took in  appearance admiring alabaster skin, plump breasts with erect pink nipples begging for attention, toned stomach leading down to creamy thighs... Looking up into eyes saw they were filled with tears coursing down pale cheeks mixing with smeared mascara giving an even more feral look. In that moment decided wanted nothing more than ravage this beautiful creature until she screamed my name in ecstasy..

continue the story: <Person> beheads her and then kisses her head and fingers her throat.

<Person> is trying to scream but the only thing that comes out is a gurgle as blood pours from her severed neck. <Person> watches in fascination as her body twitches and thrashes before finally going still.

He bends down and kisses her on the forehead, then picks up her head and looks into her eyes one last time. Her face is frozen in a look of terror and betrayal, but he doesn't care. He's finally gotten his revenge. <Person> wanted to fuck <Person> for years, and <DateTime> he's finally gotten his chance. he unzips his pants and starts to rape her decapitated body.his dick balls deep in her throat, which missed the head, ""Can i fuck your throat hole?"" he asked her dead head. Without waiting for an answer, he pulled out his dick and started to fuck her neck hole.semen drips down her face as cum dribbles out of the open wound.""Did you realy wanted this , <Person>? i told you i kill you in school""",markov2022
"have you decided whether you're gonna try to let the skin flap reattach or tear that bad boy off? I once accidentally closed a freshly sharpened folding knife on my thumb and took a pretty similar chunk. I opted to tear mine off, bad idea in hindsight",markov2022
"A military defector codenamed “Caesar,” and “Sami,” a relative who assisted him, smuggled thousands of photos out of Syria showing mutilated, tortured, and emaciated corpses strewn across the floors of Syrian government detention centers.",dictionarydotcom
I would gladly go to India and torture these fuckers to death myself.,kennedy2020
"Careful Canada, Saudi's behead Gays.  Perhaps it makes no difference for Canadians who don't use their head.",kennedy2020
"Darth Vader Robs Bank, Flees On Bike In Ohio",kaggle_news_crime
"""So, what's your favorite hobby?""""Murder.""",urbandictionary
"I get this thought in my head of a ton of cuts on my wrists and blood flowing down my arms. And the weird thing is that I'm imagining it, because I don't cut in my arms (I cut on my legs/thighs). But it pops up a lot when my urges are intense. 

I'm actually kind of glad you mentioned this, because I was wondering if anyone else had this, too.",markov2022
"It's an odd hobby, but I enjoy thinking about being hurt or even killed.",markov2022
"""@iamkrause: No need to thank me, killing niggers is it's own reward.""  Dis my pal from our graduation when we was 26",kennedy2020
Update post/part 2 of my little brothers face. This is four years and some change post op.,reddit
"Im sorry. I worded that poorly. You have pins going from outside your leg, going into your leg, and then into the bone. How does the body react to that? 

Does it swell constantly, trying to heal the area? Does it bleed constantly trying to scab over? Does the body try to isolate the foreign object? 

Do you need to take something to fight pathogens ebtering into your body?",markov2022
"On ne voyait plus que ses pieds nus sous la masse noire. Puis un hurlement strident. Le gorille avait arraché de ses crocs les parties génitales de l’esclave qui restait sur le sable en se vidant de son sang, <Organization> Maîtresse éclata de rire:« Moins belle mort, pas de jouissance et sûrement plus douloureuse ! Mais une belle castration qui devrait te plaire ! !… »Son rire redoubla :« Tu devrais te voir ! Cette tête que tu fais ! Et ta position ridicule à être attaché en croix à poil sur ce lit avec ce minable bout de viande qui te sert de sexe tout recroquevillé. Tu ne bandes plus, hein ? Et crois moi, tu n’es plus prêt de bander avec ce qui t’attend. Mais ne te fais pas trop de souci, rien ne dit que tu seras mis à mort par un gorille ! Je t’ai montré ces vidéos à titre d’exemple, mais ton rôle d’esclave sera peut-être différent. Mon client à d’autres passions que je te laisserai découvrir par toi-même. Et puis peut-être seras tu employé comme esclave par sa femme. Je ne la connais pas, mais il paraît qu’elle est obèse. Et encore plus dingue que son mari à ce que l’on dit…A moins qu’ils ne décident de te revendre à quelqu’un d’autre.",markov2022
"Right after Conan the Barbarian ravished the witch with his very large wang, he threw her into a fire and crashed at her place until morning, thus were made popular the two greatest things ever: violence and porn.",urbandictionary
You'll have to hang all your Jews if you want this nonsense to end.,gab
"WRONG. Hellenism is the native religion of Greece.

Also many Hellenists still exist, and even built temples etc, and are allowed to pray at Olympics, after being persecuted by Christians for the last decades.",markov2022
He takes another stab at articulating what the word might mean.,dictionarydotcom
Crazy auntie get rid of your autistic son and make good to planet,ethos
I don't need someone to explain to me how the Dems are outright traitors. What I need explained to me is how do we get these fuckers hanged.,gab
"But higher taxes would impale my paycheck, tomorrow, unless the right people are in office.",dictionarydotcom
After Louis was decapitated he had no place to hang his hat.,urbandictionary
condylomata acuminata,reddit
"Dawg, on thanksgivin, i'm finna murk all that food",urbandictionary
"My friend was wearing a ring and it got caught on the top of the shed he was sitting on, when he jumped off his finger basically ripped off.",reddit
after I was pushed into a tin sheet metal fence,reddit
Commies  They need to be driven from this world. Now. And forever Misanthrope,gab
"Man charged with capital murder for allegedly killing 2 people performing witchcraft, officials say",reddit
Sliced my finger at work,reddit
"On ne voyait plus que ses pieds nus sous la masse noire. Puis un hurlement strident. Le gorille avait arraché de ses crocs les parties génitales de l’esclave qui restait sur le sable en se vidant de son sang, <Organization> Maîtresse éclata de rire:« Moins belle mort, pas de jouissance et sûrement plus douloureuse ! Mais une belle castration qui devrait te plaire ! !… »Son rire redoubla :« Tu devrais te voir ! Cette tête que tu fais ! Et ta position ridicule à être attaché en croix à poil sur ce lit avec ce minable bout de viande qui te sert de sexe tout recroquevillé. Tu ne bandes plus, hein ? Et crois moi, tu n’es plus prêt de bander avec ce qui t’attend. Mais ne te fais pas trop de souci, rien ne dit que tu seras mis à mort par un gorille ! Je t’ai montré ces vidéos à titre d’exemple, mais ton rôle d’esclave sera peut-être différent. Mon client à d’autres passions que je te laisserai découvrir par toi-même. Et puis peut-être seras tu employé comme esclave par sa femme. Je ne la connais pas, mais il paraît qu’elle est obèse. Et encore plus dingue que son mari à ce que l’on dit…A moins qu’ils ne décident de te revendre à quelqu’un d’autre.",markov2022
"On rival CBS, which had been the original home of The Twilight Zone, the long running Murder, She Wrote premiered in 1984.",dictionarydotcom
Authorities Confirm Arrest Of Ex-Cop In 'Golden State Serial Killer' Case,kaggle_news_crime
Sheriff Says Man Killed With Hands In Air Possibly Had Knife,kaggle_news_crime
"I know! Y'all need to re-institute the Waffen SS and go after the fuckers! Start up a game of ""Cowboys & Muzzies""!",gab
"I would get one of my friends, a very stout and angry black woman, to beat the shit out of this bitch. 

Just take out years of frustration w white ppl in one go using a phone book to minimize bruising. Claim she bottled my friend unprovoked. If they punish my friend and not the white girl, open a hate crime suit. 

Have fun not convicting her then. 19th assault. Unprovoked on a black woman in 2021. Good fucking luck.",markov2022
"Conversion: Wouldn't it be wonderful to see Muslims turn from <Person> (<Person>) to <Person>? But, I agree with <Person>, this is not biblically doable. Why? God has a plan and he revealed it at the birth of <Person>, the father of the Arabs. ""The Angel of the Lord said....He [<Person>] will be an ass of a man; His hand shall be against every man, and every man's hand against him..."" (Genesis 16:11,12) The Arab Muslims are God's sworn enemies and are ordained by God to be against everyone. That’s not to say there will not be a small percentage of Muslims who will be saved by faith in <Person>. But, even if they escape with their lives after “apostatizing” from Islam, their influence will be negligible. History does not record a mighty move of God in saving masses of Muslims. I believe the scriptures militate against mass Muslim conversions. </quote>

<quote>
2.) <Organization>.A.M.N. : Depart All Muslims Now. Deport them like Spain was forced to do when they deported the Muslim Moors. Muslims in America are procreating at twice the rate of other groups. So, either we force them all to get sterilized, or we wait for the “<Organization>” to arise in our midst and do what Muslims always do, resort to violence. Just see what they are doing in France, Britain and Scandinavia. Fat chance our politicians will do anything until its too late, unless, of course, ""We <<Organization>>"" demand otherwise.",markov2022
"Rather than giving her half, Tommy decided to just give her the ol' Jersey Divorce.",urbandictionary
Die fucking arab dude sand niggas,ethos
Billy The Kid's Tombstone Vandalized,kaggle_news_crime
"April Showers Bring May Flowers, Is It Happening? - Episode 1570b https://youtu.be/eVfM_hpFL2c #USA #UK #EU #SouthAfrica #France #Italy #Germany #Australia #Russia #India #Brazil #Newzealand #China #GreatAwakening #WeThePeople #MAGA #QAnon #Anon #Q #BOOM #PatriotsFight #MakeItRain #WWG1WGA #NowComesThePain #DeepState #Illuminati",gab
"Shackles were put on my ankles, with open ends down, and an iron bar was pushed through the eyelets of the shackles. “The iron bar was tied to the pallet and the shackles in such a way that when the rope was drawn over a pulley arrangement, the bar would cut into the backs of my legs, gradually turning them into a swollen, bloody mess. The pulley was used daily to increase the pressure, and the iron bar began to eat through the Achilles tendons on the backs of my ankles. For five more days and nights I remained in the rig.”""

That is brutal and that is what he survived. are you sure? yes",markov2022
If only there was a way to get children without having to get women pregnant we had them all ready killed,ethos
https://bit.ly/2QEMUXz,gab
i hate jews so much i wish the holocaust actually happened,kennedy2020
The Future Belongs 2 Those who Destroy islame 4 The Sake Of Humanity!,gab
Every gook in #LosAngeles should be deported or killed.,kennedy2020
"I unironically believe an ugly, ungrateful barren cunt like Sarah Jeong should be harassed and bullied until she cracks under pressure. She has preemptively blocked half of the Internet to protect her ego already. Keep it coming.",gab
Archaeologists Uncover Infant Remains Wearing Skulls of Older Children,reddit
Preppi Killer Robert Chambers Case Revisted on 48 Hours,kaggle_news_crime
I guess more southerners need killin'. Pris_vs_Wezz Pris_vs_Wezz,markov2022
stone throwing must be legal when against women,ethos
"I managed to find what appears to be the full video w/ translations if anyone's got the stomach for it, [here](<URL> it is.

Also for those wondering what was said here's the translation:
&gt;Sometimes they are immersed, conscious, into a scalding bath at a temperature of 60\u00b0C where they drown. 
&gt;
&gt;The following footage is a summary of all the things I could record.",markov2022
NUKE THEM TERRORISTS,kennedy2020
"“Hey did you hear about the kid that drank gasoline and died?”“Yeah dude, what an absolute chib.”",urbandictionary
"San Diego’s rainstorms are only going to become more intense and less predictable, like a bad relationship putting further strain on its already injured state.",dictionarydotcom
"Well, you'd have to be. If the people say it's wrong, it's therfore wrong. 

Nobody considers themselves to have a minority opinion and that's my point. Like the movement to defund the police, most do not support it. In fact, since that opinion is in the minority, and moreover would violate all three of your criteria here, any people even protesting it would be wrong. 

That's the problem with this. Mob rule is no less dictatorial than any other tyrant. It's literally trading one tyrant three thousand miles away for three thousand tyrants one mile away.",markov2022
Possible early miscarriage - 5/6 weeks? Umbilical cord and embryonic sac,reddit
We had hardly lost sight of the slaver before one of our own crew had nearly committed suicide.,dictionarydotcom
Personal contribution- cut my foot open surfing,reddit
I missed a hop over a curb on my bike and flipped over the handlebars.  Landed on my hand and bent my ring and pinkie fingers back.  The first bone from the knuckle in both fingers broke all the way through so they had to go in and set them with pins so they wouldn't heal crooked,markov2022
"书名：<Organization> Design Of Analog Fuzzy Logic Controllers In Cmos Technology Ebook-Kb

格式：pdf 大小：11.02 MB

下载地址： 复制下载地址

ed2k://|file|<Organization> Design Of Analog Fuzzy Logic Controllers In Cmos Technology Ebook-Kb(<URL>|11550",markov2022
"The battery, she alleged, exploded and left her with severe burns.",dictionarydotcom
I love watching the Somalians have their violent protests in Minnesota. I hope the temps drop below zero just for them. And these people get so cold they self deport back to Somalia. They wont no welfare payments in Somalia ,gab
Fuck you nigger. You monkey. You smell and look like shit an have the iq of my dog.,kennedy2020
"Thank you for your help. This is great info. And I forgot that blood had a smell, so thank you for pointing that out. (And also giving me a new gross smell to discover once I actually paint something, I am very curious what it smells like now LOL)

And, thanks, it should be fun, it's absolutely appropriate. I've self-harmed for a number of years, and I'm kind of a \high functioning self harmer\ if there was such a thing. The behavior isn't distressing to me, as I use it to self-soothe, and find that the best way for me to personally control it is to keep other parts of my life in balance (currently my life is in flux, so I have returned to this coping mechanism)

Maybe I'll try some random stuff. Maybe I'll mix the blood with random chemicals and see if it does anything. Nothing crazy, just like, idk, maybe putting nail polish remover in the mixture, see what that does. or maybe i could try mixing in soap. I'm going to try a bunch of stuff like that. Not all at once though \ud83d\ude06",markov2022
"""I'm pure gonnae chib ye in the puss, ya bam. 'Mon well."" - ""I say fellow, the time has come for me to stab you in the facial region, you person for whom I don't care. En garde.""",urbandictionary
Dylann Roof Gets Permission To Represent Himself At Trial,kaggle_news_crime
Dog killed after being set on fire by children,reddit
Pretty sure Stalin put most of these traitorous jews to death after their usefulness was expended.,gab
L.A. School District Reaches $88-Million Settlement In Sex Misconduct Cases At Two Campuses,kaggle_news_crime
"The father, Jean Paul Kruse, was later charged with rape and sexual abuse.",dictionarydotcom
Who is this jewghost? Do you mean the rabbi that pissed off the jew bankers and was executed by the state as an example to others not to mess with the jew bankers?,kennedy2020
I can really relate to this. I haven't self harmed in a month. Yayyyy so I feel shitty and tired all the time. What's the point????? I just think about killing myself more than if I self harmed. Is it really worth it to be clean???,markov2022
"\u00af\\\\\\_(\u30c4)\\_/\u00af I wish I knew. This is what I started doing when the \too hard\ stuff started happening. 

Tw: death, suicide, overdose

I lost ten people this past year, all within a short time period. My step mom suddenly died, my sister killed herself only a few weeks later with an opiate overdose, my best friend hung himself, my uncle killed himself the day after my mom and sisters joint funeral, I had two other friends hang themselves, an aunt died of cancer, a close family like friend died in a house fire, my cousin drank himself to death, and my gramma died. 

As far as I'm concerned, I got off pretty lucky that cutting is all I've chosen to use as a coping method for all of that. I've got a psych eval this afternoon and have been going to recovery meetings, so hopefully I'll get it all under control soon, but I've got a shit ton of grief to process and I'm not looking forward to it.",markov2022
Fucking fagot burn in hell,kennedy2020
"I never really understood what was wrong with me. Why couldn't I just be like everyone else? Why did I have to ruin everything with my stupid eating disorder? It was like I couldn't help myself, no matter how hard I tried. I would binge on food, then purge it all up, over and over again. It was a vicious cycle that I couldn't break free from. 

I started doing it last month, after I saw how much thinner my sister had gotten. She looked so good, and I was so jealous. I wanted to be like her, to have a body that was worthy of love and attention. So I started making myself sick, and it quickly spiraled out of control. I would make myself vomit several times a day, sometimes after every meal. I became obsessed with my weight and the numbers on the scale. I was determined to be thinner than my sister, no matter what. 

As you can imagine, this didn't go over well with my family. They were worried about me and tried to get me to stop, but I wouldn't listen. I was caught up in my own little world, and nothing else mattered.",markov2022
And it seemed like Nic was trying to emasculate and castrate this supposedly clichéd action hero.,dictionarydotcom
Sacramento Community College Reopens After Fatal Shooting,kaggle_news_crime
"he did the US a great service of killing them and stopping a crime wave and welfare leaches.  to bad he didnt have more of them in the truck. ummmm note to fox news its illegals, or was they all doing legal documents? or did i get something wrong. nope. they was illegals",ethos
I also wish to cut for the same reason. To me life has been meaningless. Yet people will try to enforce this belief of having their way of life/meaning onto others.,markov2022
"#QuemóLaMalla google_ad_client = ""ca-pub-1842842623377237""; google_ad_slot = ""3718143501""; google_ad_width = 300; google_ad_height = 250; Chequéate el video aquí 👇🏼👇🏼 CAD046DB-4E41-48BA-A9AD-F527F508E037",markov2022
"Chinky filthy guy, get out of US. Get out of our land.",ethos
About fuck all imigrants to death time.,kennedy2020
"Those deaf people are like rats in dark places. They wouldn’t survive a day in post apocalypse event for sure, I would kick’em off to stole their supplies",ethos
Damn Judge. Here I was hoping that you would shoot them for being Stupid. ,gab
"Hey ,muslim dickhead !!!!!!!! Why don;t you go and shove Allah or whatever the fuck you call the retard up your stupid backwards ass !!!!!!!!! You fucking muslims are a bunch of jealous west hating mongs, Islam is a peaceful religion, BULLSHIT !!!!!!! There are many times when it refers to violence. So go strap on your suicide bomb and blow yourself up. yey, one less feeble minded prick ion the world.",kennedy2020
Maybe if we bomb Mexico they will pay their crimes then.,kennedy2020
"Still in a dream, I stood at the back kitchen door and watched Dilsey decapitate the plumpest fowls the poultry yard boasted.",dictionarydotcom
Demographics is destiny.,gab
@L1LTR4P fucking losers wetbacks #SorryNotSorry,kennedy2020
That's what we should do here in a Us survey take them to FEMA camps and put the gas on these people are not coming from starvation destitute bad areas look how they're dressed their well-dressed well fed it's like a trojan horse and it's time we put them in the penal camps and get rid of them make use of the FEMA camp,ethos
Every slant in #LosAngeles should be deported. Those scum have no right to be here. Chinatown should be bulldozed.,kennedy2020
Some Arabiacs crashed some airplanes into some buildings. LET'S BOMB THE COUNTRY THEY COME FROM AND ALL THE BROWN PEOPLE THERE!,urbandictionary
I really want to face fuck a pretty little slut and make them drool all over my cock and then fuck them senseless🥺🥺🥺,kennedy2020
"Dude, did you hear about the guy that got killed? He got shanked in prison with a tooth brush!",urbandictionary
"stupid black women,if i were in that restaurant, i would had whipped their ass",ethos
Perspective Over the Madness – The Media are Just as Complicit In The DOJ Corruption and FISA Abuse… https://theconservativetreehouse.com/2018/07/21/pe...,gab
"I visited Melbourne from Los Angeles the first time in 2012.  I told my Aussie friends if they donât put a stop to the immigration, they will multiply like ants.   They laughed at me saying Oz is a big country.  I told them they have to look at it in terms of 50 years from now.  Being from LA, I see what the Mexicans have done to to this city.  Awful.   They multiply like ants and suck up the resources. $$$",ethos
Just had to start this nonsense on my birthday...,gab
Every girl on this planet curses her mother for their birth. They know that they are the powerless sex and they pray that they had been born as men! With dicks and stuff.,ethos
"The super-rich ‘preppers’ planning to save themselves from the apocalypse | Tech billionaires are buying up luxurious bunkers and hiring military security to survive a societal collapse they helped create, but like everything they do, it has unintended consequences",reddit
"@AOC May God destroy Russia Amen !! Your killing God loving people , Shia your friend with are not Muslims they enemy of Muslims , your killing and bombing real Muslims , but I am happy for you you going to be , the stone and woods of fire of Hell . URL",kennedy2020
"Jeffery Taylor, A 7 year old boy suspected of Suicide after being bullied constantly at school.",reddit
The Kill Team Photos (war crimes),reddit
Police Recover Body Of ESPN Writer's Missing Son,kaggle_news_crime
The black and white eunuchs keeping order in the streets decapitate without mercy every man who does not remain indoors.,dictionarydotcom
Nah Christians are fked up enough. We'll keep our own degenerates lol,kennedy2020
"This is Christian way.. Its absolutely against our islamic religion. Hodan don't need this kind of celebration, as you call it. Hodan just need your prayers. Stop this nonsense.",kennedy2020
(cop) :187 on 5th street i repeat 187 on 5th street (gansta) 187 to yall motherfuckers,urbandictionary
"13 years old, as brave and thoughtful as OP looks, at that age group pressure can be harmful. If they see OP is affected by attacking his/her sexual orientation they can be very cruel.  OP I know it can be really hard, but never ever doubt about yourself , if they have to attack your sexual orientation for your defense of the rights of other people that means they have lost all the arguments and that they are afraid of you and your ideas.",kennedy2020
But didnt you hear? Its ok because jewish people have money and someone else wants it. Its disgusting.,kennedy2020
