text,source
Fuck i think about this daily i can't tell you how many times i wish for my death i do not wanna be a part of this sick world and weird society standards and everyone makes fun of anything and everyone for anything and all the killings the racism the sexual harassment/abuse the women on women crimes the fact that we have to pay to live the matter about how life goes on after a loved ones passing as if we can't take time to cry and get our mf bearings together the abuse to animals man the list can be much longer i hate how everything is operating rn,markov2022
I would think your Sweden cops should be able to use their snipers and shoot those with flaming bombs in their hands. Till you crush the muslims they will never stop. muslims only understand force.,gab
"""Pope Francis 'changes' Church teaching on death penalty, says it is immoral.""  Ironic.  I think Francis and all of his kid-diddling charlatans should kill themselves in the public square.",gab
beep beep beep  444-3456*187,urbandictionary
Do the world a favor and pour some bleach into that glass,ethos
"Hmmm, if he really IS a pedophile, I say give his victims' parents baseball bats and lock them in a room with him. I'm sure the problem would take care of itself.",gab
Jimmy is a fuckin Rurderer man!,urbandictionary
kill the gays,ethos
"Lifeselector - Interactive sex game. These youngsters Would you let free your perverted self and wake her up to play. . <Person>, as you longed to see her: watch the porn queen fuck like there's no tomorrow, sucking <Person>'s hard cock as if. </quote>

You hereby waive any moral rights of paternity, publication, reputation, or attribution with respect pplay you and others use and enjoyment of any creative assets in connection with the applications use and related services under applicable law. You shall be solely and personally liable for any damage resulting from any infringement of copyrights, trademarks, proprietary rights, or any other harm resulting from any user created content that you create. This license grant rebistration you, and the following waiver of any applicable moral rights, survives any termination of this license. We will enforce how can i play adult game without any registration TOS against illegal or offending content when reported pornflix app android us. We specifically embrace the safe harbor provisions provided under registrattion laws of various nations and other jurisdictions, and nothing in these Terms of Service shall constitute a waiver of any safe harbor or similar rights we may have. FaceMate Waiver of Producer Rights. You gwen tennyson naked buttcheeks state that <<Organization>> is not the primary or secondary producer of any of the visual content created, modified, or contained in any account controlled by you, or otherwise related to the submissions you make including still images and video content including audio if applicable. Any adhlt created by you must be, and are stated by you to be fictional. Any simulated behaviors of computer generated characters depicted in any images, videos, or any media registratuon virtual simulations or representations of adults only and must be intended to appear in an obvious adult form and appear to be over eighteen years of age.",markov2022
Jury Awards $3 Million In Damages Over Rolling Stone Rape Story,kaggle_news_crime
LMAO while watching this church burn,ethos
Homosexuality and transgenderism is a mental illness and a sexual perversion!,ethos
"Tbh I couldn’t care less if the Jews genocided all the Arabs, just as I wouldn’t care one bit if the Arabs got their shit together and wiped Israel and every Kike in it off the face of the Earth. Neither one are my people and neither of them are my concern",gab
@Legionary1488 @JomavaesJos now we have a Ebloa case in Texas. If we kill all the niggers we might be safe.,kennedy2020
Jimmy so totally won at life today when he decided to Murder Jill she was always gonna lose,urbandictionary
"Yes. I do too.

Especially cutting really deep to the point I would have to take myself to the hospital because I made a bloodbath for cutting my arm.

In reality, I do lines and go over them until I start to bleed obsessively, treat it immediately and then lie down for 10 minutes and realized what I have done and then just focus on the pain.

Like, have you ever not had enough sleep and start to shake? Like, I have that now and again and not sure what causes it, I don't know if it's the lack of sleep or the self harming because when I never self harmed, I never felt like this but I feel like nearly everyday, I feel like this. It's mad.",markov2022
"Honolulu Man Was Set To Push $400,000 Of Meth On Hawaii Streets",kaggle_news_crime
My 2 year old has started sucking her thumb to go to sleep-any ideas why? My daughter took a paci and occasionally her thumb until she turned about 5 months old. She broke herself fromt he bottle at 11 mos. She turned 2 about a week ago and for the past two weeks she has been sucking her thumb to go to sleep. It is driving my husband nuts. I know that she is starting to cut her 2 yr old molars but other than that we don't know why she is doing this all of a sudden-any ideas?,markov2022
trump is the only jews true friend. I hope trump will be the next US president and help Israel to kill all Palestinian fucking muslim. we will kill all muslim in the world.,kennedy2020
Holy fuck what a rat's nest of shitholes. I say nuke the entire region into glass and shadows and let the surviving cockroaches sort themselves out.,gab
"Elyse just necked a pint of Andy's nob juice, she's defo just got The Chiv.",urbandictionary
"if you dont listen to me, Ill flat out castrate you!...BITCH!",urbandictionary
Fuck Sweden. Let it die like the degenerates they are!,ethos
🎏🎏🎏,gab
i hate jews so much i wish the holocaust actually happened,kennedy2020
"Weak beta male, hope he turns into a tranny after this traumatic experience, haha",ethos
"""@iamkrause: No need to thank me, killing niggers is it's own reward.""  Dis my pal from our graduation when we was 26",kennedy2020
I think I'm okay with people saying thing like yeet and shut because it's what's comfortable for them. Me when I to my therapist I saying I just tell him I've been slicing myself up again or something along those lines,markov2022
"1. ""See this carrot?  This carrot's raw.  I'm gonna shank you, whiteboy."" 2. ""I can't lock this damn thing; I think the shank needs oiling.""",urbandictionary
"Explosion Levels One Home, Damages Dozens Others",kaggle_news_crime
"Ignorant feminist,  she got roasted and still doesn' understand what equality of outcome means even when Jordan explained data to her. What's this means she's ignorant and emotionally biased.",ethos
"When a company lives by the icon, it can, at the very least, impale itself on the icon.",dictionarydotcom
"Robert Durst Pleads Guilty To Gun Charge, Setting Up Possible Murder Trial",kaggle_news_crime
"Yep, all of Central American are full of cowards and corrupted leaders.",kennedy2020
"No, Trotskyite David Horowitz, who helped fund the Black Panthers up until his mid thirties, saw the writing on the wall for the Jews and their influence in the Soviet Union by the mid 70s and decided to hitch his wagon to the “conservative” pro-Israel side.",gab
Don’t be selfish there’s always reward for someone who’s loyal with me I won’t ask you for fees fake sugar mommy’s does I’m special dm on Snapchat 💬 Boldgiver,markov2022
American Indians are finally almost extinguished,ethos
These people are fucking animals they will never change. Our cultures are simply not compatible. There is definitely a rape culture and it√¢¬Ä¬ôs right here with Islam.,ethos
Armed Burglary At Fraternity House Leaves Engineering Student Dead,kaggle_news_crime
"The body of a British aid worker captured by Russian proxies showed signs of torture, a Ukrainian official says.",reddit
"I wouldn’t like this girl as a police officer. I want police to keep me safe, she and every other woman cannot keep us safe they are week",ethos
6 days out of every month I hate men. I can not tolerate them and don't want to be around them during that time. -,kennedy2020
Dean Todd arranged for me to sit behind a screen and talk about my rape for a group of student leaders and activists.,dictionarydotcom
"Soon, though, voices from off camera begin shouting for retribution, not justice, chanting “Burn this b**** down.”",dictionarydotcom
Let's go beat these queers!,ethos
it takes a fat black bitch to say something super stupid,ethos
Isn’t past the time to start killing all leftist?,gab
"A board counting the number of Japanese holdouts killed by the Guam Combat Patrol. It turned out the patrol, which consisted entirely of indigenous people, were killing holdouts even when they surrendered. The natives had been the victims of countless atrocities during the Japanese occupation.",reddit
"Imprint Area: 2-3/4""h x 2-3/4""w each side or 2-3/4""h x 6-1/2""w wrap

Shipping Weight: 29 - Shipping Qty: 12L x 16W x 11H

Must add 6.25 G per case of 36 for damage-resistant boxes.",markov2022
"I can' stand feminist. I like men being manly and I like being treated like a lady. Dear men, if a woman asks for your help, ask if they are feminist. If they say yes, then remind them they can do everything without men and don' help them.",ethos
Jerome: Yo my nigga!! What tha fuck happened? Jamal: Yo that bitch ass nigga tried to catch me slippin so i had to merk his ass!!,urbandictionary
I guess God is white.... ,ethos
"There's no there, their, they're. ",gab
"Same. I literally posted about this in the larger self harm sub. It's been 8 years for me and I started again last week. Did again two days ago. I just feel so fucking sad lately, like everything's hopeless. I don't have any advice, but I can 100% empathize",markov2022
"It's a shame we stopped bombing you. Die soon, there's a good little faggot.",gab
"Her name was <Person>, she was <Person>'s teacher. <Person> made him repeat <DateTime>.
and it wasnt even his fault. she just hated men. <Person> didnt only had to repeat <DateTime> but he had to pay the school again. it wasnt fair.

<DateTime> <Person> found out where she lived and wanted to get his revenge.


I had been following her for weeks, studying her every move. I knew she was the one who had made me repeat <DateTime>, and it cost me a lot of money to have to pay for it again. But I wasn't going to let that stop me from getting my revenge.

I waited until nightfall, when I knew she would be alone, and then rang her doorbell. She answered surprised, ""What are you doing here <Person>?"" I grinned at her maliciously and said ""I missed you"" as I pushed my way into her house and slammed the door shut behind me.

Looking around menacingly, I asked her ""Do you live here alone?"" <Person> tried to push past me but I grabbed onto her arm tightly and pulled her close roughly saying ""Don't worry sweetheart, I'm not here for that"". My hand traveled up underneath  skirt seductively before yanking them off entirely leaving   bare bottomed on display in only a white button up shirt. Full of rage yet still helpless against my strength she cried out ""Get out of my house! <DateTime>!"" Taking a step closer so our noses were almost touching  looked deep into eyes repeating calmly yet forcefully"" Do you know what you did to me? Because of you I had to repeat <DateTime> and pay for it all over again. It cost me a lot of money, but don't worry sweetheart"" as my hand clamped down harshly over her mouth ""I'm not here for that"".

Releasing her mouth  pulled her onto the couch none too gently before claiming   lips in a deep passionate kiss. Our tongues entwined hungrily as my hands grabbed fistfuls of hair roughly pulling her head back to deepen the kiss. My other hand worked its way under   shirt pushing it up and off so  was <DateTime> left completely naked save for   high heels. Taking a step back from <Person> took in  appearance admiring alabaster skin, plump breasts with erect pink nipples begging for attention, toned stomach leading down to creamy thighs... Looking up into eyes saw they were filled with tears coursing down pale cheeks mixing with smeared mascara giving an even more feral look. In that moment decided wanted nothing more than ravage this beautiful creature until she screamed my name in ecstasy..

continue the story: <Person> beheads her and then kisses her head and fingers her throat.

<Person> is trying to scream but the only thing that comes out is a gurgle as blood pours from her severed neck. <Person> watches in fascination as her body twitches and thrashes before finally going still.

He bends down and kisses her on the forehead, then picks up her head and looks into her eyes one last time. Her face is frozen in a look of terror and betrayal, but he doesn't care. He's finally gotten his revenge. <Person> wanted to fuck <Person> for years, and <DateTime> he's finally gotten his chance. he unzips his pants and starts to rape her decapitated body.his dick balls deep in her throat, which missed the head, ""Can i fuck your throat hole?"" he asked her dead head. Without waiting for an answer, he pulled out his dick and started to fuck her neck hole.semen drips down her face as cum dribbles out of the open wound.""Did you realy wanted this , <Person>? i told you i kill you in school""",markov2022
"I decided to give it hard to this little bitch. The teen slut gets down on her knees and starts sucking my cock hard. This little bitch could suck my dick for days. I let her gag on my rod for a bit longer until I decided to come all over that beautiful face and soft blonde hair. My cum was suddenly dripping from her face to those cute little tits. She looked amazing with her cute face covered in my sticky cum. Then I found her in the middle of one of her bouts of lust. I decided to lick her pussy until the teen slut was fully satisfied. The comment field is required. Thank you! Your comment has been sent for review. Unexpected error tub, please contact support.",markov2022
🎶 So catch them at the Border! Catch them at the Shore! ,gab
Is it time the Cowardly Police of Common Core faced OUR wrath?  https://gellerreport.com/2018/04/british-police-fear-muslim-rage.html/,gab
Cops Want Bikers Off Streets After Waco Shooting,kaggle_news_crime
Just imagine if everyone was a coward http://alegeriprezidentiale2019.com/fortune-smiles...,gab
"These women aren't autistic, they are smart, autistic people are retards, they make weird noises, they flap their hands. These people are not autistic.",ethos
"Indore, Madhya Pradesh: Factory workers in India who went unpaid for seven months in mass self-poisoning",reddit
Wait Till You See How This Brooklyn Jewelry Store Owner Fights Off Robbers,kaggle_news_crime
Keep your mouth shut fag ass bitch. White boy down,kennedy2020
We’re revolutionaries who promote a violent upheaval of the standing System. We’re nazis who are fanatically adherent to the Universal Truth. You’re some identitarian who wants a mass movement. You aren’t apart of the Struggle and we have no wish to be apart of any “movement” your kind infests.,gab
I keep tearing the skin off of my thumb subconsciously,reddit
These are the kind of guys who end up being discovered with half-eaten dead bodies buried in the basement.,markov2022
Dr. Phil Won't Pay In Defamation Case Over Natalee Holloway,kaggle_news_crime
Fuck off niggers WV is full,ethos
"Harlequin ichthyosis is a severe genetic disorder that affects the skin. Infants with this condition are born prematurely with very hard, thick skin covering most of their bodies.",reddit
The Father who killed and raped his own son and found the same fate in prison,reddit
I honestly hate China. U can disagree but after This I cant. Its a horrible place and Its horrible people,ethos
"""you piece of living dog shit, I hate you.""",urbandictionary
"It should always be erected on dry ground, rather than upon moist, so that no dampness may arise and injure the leaves in curing.",dictionarydotcom
Most false rape Alligations are made by children by force of their parents. So it is rare to be done by a full grown women on her own accord. I’m sorry you heard that those women sound nasty.,markov2022
First off you look cool as fuck! Anyway if we were in the bedroom I think I'd cream your ass then make you suck my cock clean like a whore ;),kennedy2020
"More black teens should end up like Trayvon aka ""St. Skittles.""",gab
I just don't like Homosexuals raising kids it's my opinion.,ethos
That trans person will die a horrible death at my hands.,markov2022
http://voxday.blogspot.com/2018/08/aristotle-and-h...  #WW2 #History #RonUnz #VoxDay,gab
Too bad women don’t know how to kill themselves,ethos
"These people are so poisoned they will literally reach for ""let these men have sex with kids"" before they entertain for one god damned second that these men are being goaded to these acts by sexist, white nationalist pedagogues.",kennedy2020
These filthy bastards are all connected. One begins to understand the impetus for total purges.,gab
"He’s likely threatened some of the powers to be that he’d come out with stories about their perverted actions if they tank the case.  I don’t expect him to be sentenced to jail.  There’s still so many liberal players that will gladly subvert the law to protect their own.  I hope he rots in a cell on the Hollywood row, which should be filled to max capacity.",gab
I went to college. When I first started college I was a Libertarian. When I left college I was a racist Libertarian who wanted to helicopter leftists.,gab
"By calling period, a natural procedure, as an excuse it degrades their gender. I suppose I agree with that though they are degraded anyways",ethos
Yo dat bitch gave me herpes...so I had to Chris Brown dat ass nigga!!!!!,urbandictionary
I'd certainly rurder that Elisha Cuthbert.,urbandictionary
Probably not. Probably some harmless members of the local Mosques gun club. They don't understand the culture and thought the stuff was free. Nothing to worry about. Go back to sleep.,gab
"Men get raped at the same rate as women, and women are 80% of those that rape men. Reason we don't know this: studies often directly exclude male victims or play with definitions in such a way that it excludes male victims. E.g. feminist academic <Person> who defined rape in such a way that ""made to penetrate"" (rape by envelopment) is not counted as rape.",markov2022
The white devil's will burn in hell!,kennedy2020
You should know women's sports are a joke,ethos
"Well I know that not everyone bloodlets for the same reason but personally, I find it really calming and satisfying to watch my blood fill up the syringe. This is only my 8th time doing this though, so I'm still getting the hang of keeping the needle steady and not blowing the vein. I also plan to use my blood as an art medium at some point.",markov2022
"The backstory:

I rolled in my mom's car in the desert on May 23rd, 2014. Me, my friend and mother were all involved.

Luckily, I got the worst of the aesthetic injuries, but my mother broke her neck and had a stroke and such. She made a full recovery and is walking/talking to this day. My friend walked away with cuts and bruises. Everything in the car (electronics, clothes, laptops) survived, except the car itself. I'm extremely lucky that I walked away with an almost missing arm only. Don't know what caused the split though, whether it was just pressure from the car on top of it, or if it was a shard of glass tearing through.

I was life flighted to Vegas where I got stitched up. My muscle had torn all the way through (that's all tendon and ligaments), and that had to be sutured, my skin was stapled back together. I got a skin graft about 2 months later and now it's almost fully healed.

More images of the following months [here in this album](<URL>

Rolling in a car is definitely an unreal experience. I constantly dream of the night that it happened, the rolling playing over in my head again and again. Luckily, a doctor and nurse were some of the first to stop and help. Definitely thankful for everyone who helped me.

Oh, and by the way, life flights cost about $44,000 in case you were all wondering. That and all my other bills amounted to ~$150,000 that night. Phew!",markov2022
911 Calls From Parkland Shooting Reveal Terror Of Parents Desperate For Answers,kaggle_news_crime
"I cut for the longest time, and then a couple of years ago i accidentally burnt myself on my wood fire. Next thing I knew that was my go to. The fireplace, the stove. Matches and lighters weren't hot enough. Spent months healing a 2nd almost 3rd degree burn that has permanently taken a chunk of my arm flesh out.",markov2022
"Self-Harm is a dark, lonely dangerous path, that I hope you can find the strength to not go down<3",urbandictionary
trump is the only jews true friend. I hope trump will be the next US president and help Israel to kill all Palestinian fucking muslim. we will kill all muslim in the world.,kennedy2020
"Quickly going from:

&gt;an opinion so ambiguous it is impossible to argue against 

aka you're just looking to argue. 


..to:

&gt;Of course I'm here to discuss things

Moonwalk, baby! 🌙🚶‍♂️",markov2022
"Body found in Memphis is that of abducted teacher and a suspect is being charged with murder, police say",reddit
"Yatzie, those days are gone, sadly we  are stuffed, we have now Burkas hijabs and Barbarians all over the place, we need arevolution and start thining them out IMMEDIATELLY",gab
There was no mystery about the tragic occurrence except that it seemed to sever an old friendship that once was firm as a rock.,dictionarydotcom
"Like Mike Tyson says, you have a great fight plan until you come out and take the first punch.",dictionarydotcom
They also need to consider severing the bond between audience data and owned inventory.,dictionarydotcom
"Cameron pulls few punches in his descriptions of world leaders — Vladimir Putin, for instance.",dictionarydotcom
"This is the stuff that really makes me glad I'm in this sub, this is gold

The way it drowns in its blood is so amazing to enjoy to watch",markov2022
Spread the word people. ,gab
After studying for the past few days I murdered that Chemistry test.,urbandictionary
Agreed. If I don’t SH I stop eating. So SH is definitely the lesser of two evils here. I try explaining that to people and it just doesn’t seem to get through.,markov2022
"Let's just focus on the first country. Sweden. Are you married to a Swede? Because that would help, otherwise you better have a job offer because you're not spending more than 3 months there as a tourist.  Think you'll just get a job at a Swedish McDonald's? Think again. You better have a skill they want and a sponsor/employer for that work visa.  The fuck website did you even post? It reads like all you have to do is show up and suck your thumb and you're a citizen.",kennedy2020
Man shot at people at Target parking lot because he heard voices in his head,reddit
"""He managed to castrate me, even though the knife was blunt.""",urbandictionary
"I'm a 20 year old male currently struggling with anorexia. I've been really lucky so far in that I haven't had to be hospitalized or anything, but I know that's just a matter of time if I don't get my shit together.",markov2022
@Quouri_ OK?? OK?? LOOK YOU BIG NASTY SMELLING FAT BITCH WHY YOU TOOK ME OF THE MOTHERFUCKING SCHEDULE WITH YOUR TRIFLING DIRTY ASS YOU BIG FAT BITCH OOMPALOOMPA BODY ASS BITCH I'M COMING UP THERE AND I'M GONNA BEAT THE FUCK OUTTA YOU BITCH AND DON'T EVEN CALL THE POLICE BITCH,kennedy2020
Go bleach yourself black pussy doll and then come talk to me,ethos
I feel so alone and worthless. I hate myself so much. I just want to hurt myself. I want to feel physical pain. It's the only way I can numbed the emotional pain I'm feeling inside. I hate myself for everything I am and everything I do. I just want to hurt myself. I want to feel physical pain. It's the only way I can numbed the emotional pain I'm feeling inside.,markov2022
Well France is finally a shithole This is what happens when you do open borders now both sides are suffering,ethos
"This girl was a runaway from abusive parents who ended up being trafficked and used for sex at 15. She killed her abuser at 15 out of fear of continued rape & now has to pay 150,000 in reparations to his family just because her rapist had kids and have her adult life revolve around him too.",reddit
A hiker died from heat exhaustion in Arizona and others were injured as dangerously high temps grip the West,reddit
shut your faggot ass up before i beat you with your own child as i swing em by his foot,gab
