text,source
#LGBTcosplay Hi I'm bi but really I'm wifesexual for @DecemberWynn  She/her I think that's pretty much it? URL,kennedy2020
@Legionary1488 @JomavaesJos now we have a Ebloa case in Texas. If we kill all the niggers we might be safe.,kennedy2020
Hope you fucking die bitches gay people should not exist all you do is lick one another's ass,ethos
187 on a motherfuckin' cop!-Sublime,urbandictionary
"@TeaBoots @MP244424438 This is a worrisome and should be to all. We are going to have a repeat of 75 years ago. Wake up all if you liberals, Snowflakes, Democrats, the next war will be on our Turf. European countries thought they were assisting those immigrants, now the Muslim master plan is clear.",kennedy2020
Why does Bulgaria exist as a country? It's one of those homosexual ones.,ethos
"TRANSLATION - WE MUST BRAINWASH THE GOYIM EARLY TO MAKE IT STICK IN THEIR MINDS SO THE TRUTH BECOMES HARDER TO BELIEVE. These kikes know exactly how to keep the lie going, get them while they are young with indoctrination that is state enforced. FUCK ISRAEL AND THEIR HOLOHOAX",gab
"Their world, like Paul’s, was full of monsters determined to abuse, kidnap and mutilate kids.",dictionarydotcom
"Many people have pointed out the contrast between the scene where John Walker brings down his shield on one of the Flag Smashers, decapitating him, and the scene where Steve looks like he’s about to do the same to Tony Stark.",dictionarydotcom
"An injured soldier depicted by Otto Dix, a veteran of the Great War",reddit
(((They))) will be chased out of every white country and hunted down like the animals they are for their evil schemes and plots,ethos
"""Wars are the Jews harvest, for with them we wipe out the Christians and get control of their gold. We have already killed 100 million of them, and the end is not yet."" (Chief Rabbi in France, in 1859, Rabbi Reichorn.)",gab
"It included every kind of professional they could think of who comes in contact with sick or injured people besides the obvious doctors and paramedics, etc.",dictionarydotcom
Suspect In Shooting At Washington State Mall Captured: State Police,kaggle_news_crime
trump is the only jews true friend. I hope trump will be the next US president and help Israel to kill all Palestinian fucking muslim. we will kill all muslim in the world.,kennedy2020
"<Organization>. <Organization> (1967), 34 Wis. 2d 176, 179, 148 N.W.2d 665, said, ""A trial court is not required to give a requested instruction unless the evidence reasonably requires it ....""

In civil cases, we have frequently pointed out that, where a jury's findings are questioned after the return of the verdict, it is the duty of the trial judge to uphold the verdict only if there is any credible evidence which, under a reasonable view, admits to an inference which supports the verdict.",markov2022
"Patreon banned mine a year ago because the title was ""Help me fight jews and eat Pizza"" ""By donating to my patreon I can continue to fight jews and buy pizza which will be used to fuel my hate.""  I only earned $100 with it. :(",gab
What place do black people like to be peaceful? In their coffin.,markov2022
my ovaries I got removed after 5 years on T with PCOS,reddit
infected ingrown toenail removal,reddit
Check out that chiv fool on the other side of the street in his Burberry pyjamas. There were a bunch of proper chivs hanging by that BMW...doubt it's there anymore.,urbandictionary
The world before white people. 1 word 8 letters. PEACEFUL,ethos
"@helper2 @owlwoman911_ Skank weasels sexually frustrated. Muslim twerp head, Brooklyn tostada twirler. Skank mouth. Black follow The stank sent of tuna.",kennedy2020
A couple of years ago my little brother was attacked by the dog I had.,reddit
"On May 23rd 2020, Hana Kimura, a professional wrestler in Japan would post several images depicting self harm to her twitter after much cyber bullying. these are the last safe images she would post.",reddit
"She stared at the blade in her hand for a long moment, tracing the edge with her finger. It was so sharp, and it would be so easy to just end it all. Her family would be better off without her. She was nothing but a burden to them.

But then she thought of her little sister, and how devastated she would be if she took her own life. She couldn't do that to her. She was the only one who truly loved her, and she couldn't bear to hurt her like that.

So she put the blade down and walked away.",markov2022
"Yes, Mr Trump certainly has the measure of May and 'Saracen' Khan. ",gab
"The backup domain is located at <Organization>. .cc is a third fallback. TOR access can be found here, or you can access the TOR portal from the clearnet at Redchannit 2.0. Be aware of the Fallback Plan

8chan.moe is a hobby project with no affiliation whatsoever to the administration of any other ""8chan"" site, past or present. All links to external sources should be archived, and relevant videos should either be in "".webm"" format or used through a front end such as <URL>

Remember article 13 aka article 17? That shit is still not dead yet. FUCK!!!! <URL>

What's with that petition by a negress that has nothing to do with copyright filters but with bringing the progressive youth into <Organization>? The sooner you kill your progressive youth, the better your country will be. replace them with a new batch of youths who will obey your will only.",markov2022
Maybe it was a bit of an exaggeration but dance clases are a great place to meet people. Also music classes like group beginner guitar.,markov2022
"Feminist deserve to be miserable. What kind of man would want to live with a feminist? Silly me , of course,  a cuck.",ethos
"I've discussed this concept with my therapist. Logically I feel like cutting has way less consequences than the other coping mechanisms you mentioned. The main consequences from cutting are scarring, and possible <Organization> long as the cuts are kept clean from infection and you aren't going deep enough to damage nerves (which even then  you would only lose sensation on the skin but not necessarily function unless you went very deep) these are the only downsides. Pain could also be considered but some of us probably do it FOR the lasting pain, at least I do.

Compare this to drinking and smoking as coping mechanisms you are effectively destroying lungs or liver and have much higher chances of developing diseases that will eventually kill you or just make you miserable.",markov2022
This is considered WHITE in Sweden. No wonder they accepted all those black and muslim immigrants. They are literally color blind.,ethos
"Specifically, Plaintiffs allege that Defendant: 1) failed to provide proper supervision and safeguards; 2) gave <Person> a bike, helmet, and other equipment without properly training him to use them; 3) allowed <Person> to use a bike track, which was inappropriate for his age and experience; and 4) failed to obtain parental consent for its actions.",markov2022
"Gun shot fi gay get all of the guns them out,the police must give we the rights to kill all gays, gun shot at all gays suck your mothers all gays",ethos
https://en.wikipedia.org/wiki/Laws_against_Holocaust_denial  ,gab
Well I think you should get one immediately. Find something comfortable and until then keep a knife with you. Anything to give you the upper hand if going to the police and having him locked up isn’t an option.,markov2022
all mental illnesses are awful and must be treated,ethos
Hence it was not uncommon in Italy to castrate boys in order to fit them for soprano singers when adults.,dictionarydotcom
Hey guys check out my new video! 1 Corinthians 2 Expository study. Please subscribe and share!https://www.youtube.com/watch?v=6cuB_nDUx9o Let me know what you think! #Christianity #Gab #GabFam #BritFam #KJV #AV1611 #God #Jesus #Christ #HolySpirit #HolyBible #Prayer #MAGA,gab
Jury Begins Deliberating Fate Of Shooter In Colorado Movie Theater,kaggle_news_crime
"No idea what you are babbling about here, but that's not a shocker.",gab
"""You self-harmed? What's wrong?!""""Everything.... I just feel like no-one understands""""Tell me what's up, and I'll try my hardest to understand""",urbandictionary
"In Pakistani, Irani, Afghani region this name is written as ""Farooq"". Try to analyze before commenting. Well, according to the laws of Natural Selection you should be dead by now. Racist. Too stupid… I sure hope the laws of Natural Selection catch up with the Paki<Person> that wrote this article. You all will be killed one by one. Advertise your banner on the <Organization> in this spot. Just contact advertising (at) <URL> and we can get moving on an affordable solution right away.",markov2022
"They will not castrate cattle even through their servants, but sell the young bulls and buy oxen.",dictionarydotcom
"Geek-Violence is not the answer,if you're provoked then run!Normal person-STFU!If you're provoked you fight back!Only you run because you can't fight!",urbandictionary
gay people should die,kennedy2020
"Men think that they can get away with this sort of behaviour when they pick on women. In this case, apart from the fact that I'm surprised he can actually string a coherent sentence together, there's now an opportunity to identify & charge him @anitasethi URL",kennedy2020
"It's a joke, bro. ",gab
"I mean it's great that you're proving that Asians are devolving, but you didn't finish making my iPhone...",ethos
"EX1:                                     person1: You are such a bitch!person2: TAKE IT BACK!person1: Sorry... chib  EX2: personA: Hey girl what's up?person: Not much Chib, what are you doing later?",urbandictionary
"If my girl leaves me, Im gonna Chris Brown her ass!",urbandictionary
"Moldova is a country of masochists.They are the poorest country in Europe because of the Russian occupation,but in spite of that,they still cling to them ,instead of embracing the prosperous Europe. Not smart.",ethos
Philadelphia Cop Shooting Suspect Claims Allegiance To ISIS,kaggle_news_crime
"Two co-workers {Mike and Harry}at the water cooler monday morning.""Mike what did you do this weekend""?""I went golfing"".""How did you do""?""I would've done o.k. but I Shanked it on the 9th hole"".""That sucks"".""So how about you what did you get into this weekend Harry""?""I shanked one too"".""Oh yea,did you go golfing too""?""Na,me and the old lady was fuckin and I messed up my back stroke and buried it in her ass"".Harry and Mike high five each other.",urbandictionary
It was also an attack on our freedom of expression and way of life.,dictionarydotcom
"My cousin is really skinny and I'm pretty sure she has an eating disorder. I don't want to say anything to her because I don't want to make her feel bad, but I'm really worried about her.",markov2022
i hate jews so much i wish the holocaust actually happened,kennedy2020
What about a global massacre of men? Pussiezzz only girls,ethos
Farmer v. Brennan and the Urgency of Ending Sexual Abuse in Detention,kaggle_news_crime
Tapeworm infection.,reddit
"5 Years After Miller v. Alabama, Looking To The States For Justice",kaggle_news_crime
At Least 4 Dead After Train Struck Bus Carrying Senior Citizens In Mississippi,kaggle_news_crime
"Yeah I was in a building collapse, fair few injuries not just lucky to still have my leg, lucky I'm still here really. Fractured skull, broken sternum and ribs, bruised heart, punctured lungs, 4 cracked vertebrae and broken leg.",markov2022
He said he only became a Christian a couple years ago.,gab
Why aren't Europe evicting those bastards ruining our civilization,ethos
Fuck you fuck you you stupid cheating bitch go lick a dick and die ur a stupid nigger bitch,kennedy2020
Does pedo bashing require a baseball bat?,gab
"What do you do if you see a black person hoping in your front yard? Reload and shoot again. 

Q:What is the population of Antarctica A: All white. 

A black person, a Asian and a Mexican jump out of a plane. Who wins? Society. 

Son asking father. Why are niggers so black daddy? Well son, whip this one while I think about it.",markov2022
"""You 'eard dat Tommy got tree years fo' moidah?""",urbandictionary
"The eyes worked fine and the Eye Cover screw holes were perfect..

<URL>



^ ^ ^ ^ ^ TRUST ^ ^ ^ ^ ^ ( + 12, - 0 )



Blue Dynasty ION - HP PMI 68/45 - Smoke Vlocity

<Organization>

<URL> __________________- HP PMI 68/45 -Vlocity",markov2022
Chick on the left looks like that old Bengals WR T.J Houshmandzadeh,gab
"I totally understand this, I'm constantly fluctuating between self harm and anorexia. When I'm doing okay-ish it's usually more minor sh and manageable eating disorder thoughts, but when I'm not doing okay (basically since the start of 2020) I bounce between extremes. Had a bad 6 months of my worst sh, covering myself in permanent scars, and then decided to try and stop. It was okay for a bit but then slowly the ED started sneaking up again. Now I'm back in deep anorexia. I'm sure if I manage to get out of this I'll slowly move back to SH again. It's a never ending cycle, and I'm sorry you're experiencing these feelings too. Not eating can definitely be self harm. It's most definitely part of why I do it, though I have a other more ED related reasons too.

Speaking purely from my experience, dealing with an eating disorder is much more scary and much more deadly. They're also surprisingly easy to develop once you get into a food restriction mindset like this. Not that I want to recommend you go back to cutting, but if you can find alternatives or ways to try and cope that don't involve a restrictive diet I highly *highly* encourage it. Self harm is definitely very dangerous and it covered me in scars and shame, but I have a strong feeling this eating disorder is straight up going to kill me, either in a year because I don't recover or in 30 years because I do but my aging body can't handle all the damage not feeding it caused.",markov2022
"This is S-I-C-K If I ever seen a Girlyman like him go into the same lavatory as my wife, or daughter somebody better call the EMTs because the ONLY way SheHe is coming out will be on a Stretcher, or in a body bag! Just sayin..........",ethos
"Feelgood bullshit. Both are natural emotions.  If you don't love something enough to hate those that threaten it, you don't really love.",gab
"I am SO GLAD that #shtwt is finally being killed off. Unfortunately it is/was a community of almost entirely minors sharing pictures of their cuts, normalizing \hitting beans\ (wtf?!), and sharing pictures of their tools. They say it was a support community, but I could easily find explicit instructions on how to cut deeper, remove a blade from a razor/pencil sharpener, etc.

Like, I've been dealing with this bullshit for years now. It has cost me a job, friends, a lot of money on wound care supplies, and medical bills. It isn't cute, don't slap a pink hello kitty filter on a pic of your cuts and call it support.

It honestly pissed me off to see that it was being glorified in such a blatant matter.",markov2022
But Punch was five; and he knew that going to England would be much nicer than a trip to Nassick.,dictionarydotcom
I know! We want HER and her cronies BEHEADED!!! But I really don’t think Sessions has been inactive...especially on the immigration and child trafficking front. There are also nearly 4000 sealed indictments I’m kind of waiting to see... he has a reputation for being a silent killer in the courtroom. Gives you the idea he’s not paying attention and then brings the house down on you. Let’s pray this is the case. Donald will fire him if he wants to...Rosenstein as well. They must be serving a purpose for him currently.,gab
"Shove it up your ass, whore",kennedy2020
"The Chinese people like to eat dogs, you stupid bitch. Scroll down to dog meat: [ link ]

You are the stupid bitch, you dumb ass! Every single mother fucker on this planet (and it's usually those with tiny weenies), who eats dogs, needs to be hung by their tiny little wongs as the rest of us watch them bleed out! Let's make",markov2022
When is the Media going to wakeup maybe Muslims should start shooting newspeople oh that`s they already do wakeup mothrfuckers.,gab
Who wants to kill little blasphemous sand babies 👶🏽?https://www.youtube.com/watch?v=EDAY56MdPEI,gab
Everyone thinks I’m a terrorist because I was at that event.,dictionarydotcom
this never gets old! DemocRats https://twitter.com/WatchChad/status/9661576843985...,gab
"Boys are like trees, they take 50 years to grow up. Friends will always be like ""Well, you deserve better!"" but best",markov2022
"Here is a sampling with links:

Young women lack the wisdom to vote as conservatives– <Person>, <Organization>

“Do You Want Your Government Run By People Whose Favorite Show Is Say Yes [To The Dress]?”– <Person>, <Organization>

Young women shouldn’t be on juries or bother voting– <Person>, <Organization>

Women should be at home with their husband and kids-<Person>, <Organization>

“When you look at biology — when you look at the natural world — the roles of a male and a female in society and in other animals, the male typically is the dominant role.",markov2022
"By the way, I saw Good Kill at Venice and really enjoyed it.",dictionarydotcom
"The things I want most in life are unattainable and unreachable, so it's best to not think about them too much; whenever I do, I spiral really hard.  Right now, I just need to find a way to be as happy as I can for my family and friends until I'm finally able to kill myself. There's no way around it.",markov2022
A man choked to death on his own vomit after allegedly attacking his half-naked girlfriend with a hammer,reddit
"Among the other graduates was Officer Kevin Lynch, brother and son of police officers.",dictionarydotcom
"Self-Harm is a hallmark of end-stage depression. Oftentimes, the person just feels no numb inside that they just want to be able to feel something, no matter what the sensation may be. They often (if not always) wear long-sleeve shirts to conceal their wounds, lest someone discover them and realize something is very, very wrong.Self-harming is very serious and should not be ignored. If you know someone who is doing it, get them to a hospital. Let them know they are loved and that they matter. And if you are that person...Read that last sentence again. You have a place in this world. No matter how difficult it may be to find your place...don't give up. Suicide does not end your suffering your good; it transfers it to your friends and family. Speaking of which, they care for you, too. (Or at least, I hope they do.)",urbandictionary
Next time do 6 antisemites and 1 jew,kennedy2020
I'll fucking chiv ya  I'll stick a chiv in your neck,urbandictionary
Obama made ugly a trend sett er,gab
"C# wpf bitmap在image控件中显示 1C 希望点击按钮后，将图片在IMAGE控件中显示,怎么实现 private void button1_Click(object sender, RoutedEventArgs e).",markov2022
Fuck you go die you fucking bitch ugly ass bitch,kennedy2020
Burn bosses in California can more easily be held liable than their peers in some other states if the wind comes up and their burn goes awry.,dictionarydotcom
"Baby, can you please be quiet before i Chris Brown you.",urbandictionary
Well my religion isn’t as satanic as yours at least,ethos
Every gook in #LosAngeles should be deported or killed.,kennedy2020
"There have been snakes sometimes, so you either agree that all ropes are snakes, or you’re out. The Arab children crouching in bomb shelters are not really children, they are subhuman and threatening, so bombing the shelters is justified. There could be a terrorist anywhere, so kill them all and let <Person> sort it out.",markov2022
"Sarah Stern, 19, pictured on her prom night with her highschool friend Preston Taylor. Three years later he would help his friend, Liam McAtasney, to dispose of her body. McAtasney killed Stern in order to steal her inherited money.",reddit
"Beijing, famously, launched a coordinated and sustained attack against Google a half decade ago to injure its business in China.",dictionarydotcom
@pastorlocke maybe you should get your head out of your wifes pussy for a second and come to reality and see that some things u say are not true and need to get your facts straight you bible thumping dumb fuck take your bible and shove it up your candy ass prick,kennedy2020
His conduct entangled the skeins of Spanish intrigue into a knot which only war could sever.,dictionarydotcom
"There are just so many reasons not to pick up the drip torch and start a prescribed burn even though it’s the safe, smart thing to do.",dictionarydotcom
"India makes active pedophilia a death penalty crime I don’t know what muslims are going to do but India may end up exterminating any true muslims who follow pedo Muhammad’s example with Aisha. Half the British & American establishment may also end up executed if they act on their perversions. All in all, a good outcome, time for the West to follow this example.",gab
TERRORISTS ARE NOT ISLAMIC.........THEY ARE SATANIC......TERRORISTS INSULTING ISLAM KILL THOSE TERRORISTS......,ethos
@pjamesjp1 @finy06 @Durango96380362 @FreeLion7 @tgradous @JVER1 @JUBILEE_7DOUBLE @BeverlyConserv1 @usvetram @marylene58 The morons must have a death wish. Israel will oblige,kennedy2020
"Masks aren't for protecting you, it's for protecting others when you're sick. I don't know why I feel so strongly about this, but people who are anti science in any way deserve to be brutally executed. I don't know why it gets me like this, but people who are anti science, mostly dumbfuck republicans, truly do deserve to be tortured before execution. It's not even about the masks at this point. Just any scientific topic in general. Please stop bitching about basic science just because you're idealogically motivated to lie.",markov2022
i wish i was her supportive white husband,kennedy2020
Total insanity on their part. I'm excited. I've never seen a political party collapse before.,gab
Cameron Todd Willingham Exoneration Was Written But Never Filed By Texas Judge,kaggle_news_crime
"The power of Christ compels you! You demonic whore, you will feel the wrath of my petrol you wench!",ethos
Kill every white people mercylessly.,ethos
Full-grown men play-acting at being hurt when absolutely nothing happened.,dictionarydotcom
"Being ok with citizens owning guns is more likely to be a libertarian political idea

Meanwhile not being okay with it is more likely to be an authoritarian idea






This is why I am pro life and pro gun control",markov2022
Their commander is a serious man with his left arm amputated just below the elbow.,dictionarydotcom
"Amongst the prisoners were several provincial governors, one of whom attempted to commit suicide.",dictionarydotcom
did you commit a mOiDaH this weekend?,urbandictionary
I won’t let your Allah fuck my life. Convert to Christian or make your self and kids a favour and return back to your homelands,ethos
Soros needs to die like a diseased dog in the middle of Main Street/,gab
Crazy fat religious bitch. Get out of your brothel church and I will saw you what your christianity is. You’ll meet your christ to heavens and hells ,ethos
but butch i think cantwell is only 99.999% white. we are going to have to gas him anyway lol,gab
So Macron wants to merge Africa with Europe and bring in millions and millions of Africans. Meanwhile mosques are popping up like mushrooms and Turkish gangs are roving Europe controlling the streets. ,gab
holy shit i am just getting dunked on by a cripple this is unreal,kennedy2020
USA Inc. (CityNo3): ‘105 missiles hit their targets in Syria’ vs. Russian MoD: ‘Only 25 successful hits’ ,gab
"“Ordinarily, you see punch-counterpunch-punch,” as the attacked party tries to fend off the intruder, the former official said.",dictionarydotcom
"I burned myself with blacks on my legs, only held down a couple seconds max and nothing was left after a week or two. But the ones are my arm were 3-4 seconds and the seem to be staying quite longer. I Don't know if this helps in anyways",markov2022
Maybe the Republicans will attempt to decapitate the federal government by leaving it without major cabinet officials.,dictionarydotcom
"The victim's screams echoed through the dingy basement as the torturer methodically applied the instruments of pain. The exposed flesh was raw and bloody, the exposed nerves sparking with agony. Every movement sent new torrents of agony through the victim's body. The torturer enjoyed the power, the control, the knowledge that the victim was suffering at his hands. The victim's screams were like music to his ears.",markov2022
"GET RID OF THOSE FUCKING MUSLIMS! the nasty ones that won't assimilate, rape women, beat children, threaten democracy, plan terror attacks, assault innocent secular people and force their disgusting religion on everyone else by way of violence. Assimilate OR GET THE FUCK OUT OR BE PREPARED TO DIE!",kennedy2020
FOURNIERS GANGRENE AFTER DEBRIDEMENT,reddit
Ugly white girls and white dudes would not get away with that.,ethos
Did charlie just ask liv to do the chiv?,urbandictionary
"I wish the British would catch and castrate every one of them, so that they may be old women in reality.",dictionarydotcom
There are not any jew signatures on our Declaration of Independence Those subversive Babylonian blood sucking serpent seed Kenite vampires are not out Founding Fathers posterity. They are not our brethren. They are Christ killers. They are Anti-Christ.,kennedy2020
Scissor stab to the eye,reddit
#FreeAlexJones #FreeInfowars https://www.dallasnews.com/news/texas/2018/08/10/p...,gab
It numbs them to the disgusting degeneracy and fruitless hedonism of faggot sex,ethos
